{
  "$schema": "https://json-schema.org/draft/2020-12/schema",
  "$id": "https://kora.local/kora-stream-games/mapa.schema.json",
  "title": "Spec de mapa",
  "description": "Layout da torre. Gerado pelo Gemini a partir de descrição em texto (F4, P1) e validado antes de tocar o disco. Duas regras deste schema são cruzadas entre campos e vivem em scripts/validar-contratos.mjs: (a) espacamentoVertical <= jumpHeight * 0,7, que é o ADR-009 e é o que garante mapa vencível sem presente nenhum; (b) skyboxAssetId, materialAssetId e props[].tipo têm que existir em data/acervo.json com status aprovado, que é o ADR-004.",
  "type": "object",
  "additionalProperties": false,
  "required": ["mapaId", "streamerId", "nome", "geradoPor", "totalPlataformas", "jumpHeight", "skyboxAssetId", "paleta", "plataformas", "marcos"],
  "properties": {
    "mapaId": { "$ref": "comuns.schema.json#/$defs/identificador" },
    "streamerId": { "$ref": "comuns.schema.json#/$defs/streamerId" },
    "nome": { "type": "string", "minLength": 1, "maxLength": 80 },
    "geradoPor": { "type": "string", "enum": ["gemini", "manual"] },
    "promptOriginal": {
      "description": "A descrição que o streamer digitou. Guardada para ele poder regenerar variações.",
      "type": ["string", "null"],
      "maxLength": 500
    },
    "geradoEm": { "$ref": "comuns.schema.json#/$defs/instante" },
    "totalPlataformas": {
      "description": "Altura da torre. O padrão do produto é 5000: torre curta acaba no meio da live e o jogo fica sem para onde subir — e com presente sem teto de delta, 1000 andares viravam meia dúzia de donates. O teto existe porque cada plataforma é um Instance.new no carregamento do mapa.",
      "type": "integer",
      "minimum": 100,
      "maximum": 5000
    },
    "jumpHeight": {
      "description": "Altura de pulo do personagem em studs, aplicada no Humanoid. É o que define o teto de espacamentoVertical. Ver ADR-009.3.",
      "type": "number",
      "minimum": 7,
      "maximum": 12
    },
    "skyboxAssetId": { "$ref": "#/$defs/idAcervo" },
    "paleta": {
      "type": "object",
      "additionalProperties": false,
      "required": ["primaria", "secundaria", "destaque"],
      "properties": {
        "primaria": { "$ref": "comuns.schema.json#/$defs/corHex" },
        "secundaria": { "$ref": "comuns.schema.json#/$defs/corHex" },
        "destaque": { "$ref": "comuns.schema.json#/$defs/corHex" }
      }
    },
    "plataformas": {
      "type": "object",
      "additionalProperties": false,
      "required": ["formato", "raioBase", "variacaoRaio", "espacamentoVertical", "variacaoHorizontal", "materialAssetId"],
      "properties": {
        "formato": {
          "description": "Como os degraus são construídos, e é a regra de jogabilidade que muda junto (ADR-009). \"disco\": degraus separados, com VÃO entre as bordas, que o jogador vence pulando — o passo tem que ser maior que o raio. \"laje\": lajes largas que se ENCOSTAM formando um caminho contínuo, sem vão, subidas quase andando — o passo tem que caber dentro da laje. As duas regras são opostas, e o validador escolhe pela formato.",
          "type": "string",
          "enum": ["disco", "laje"]
        },
        "raioBase": {
          "description": "Meia-largura do degrau ao longo do caminho. No formato \"disco\" ele tem que caber DENTRO do passo horizontal, senão as plataformas se cobrem e não há salto. No formato \"laje\" é o contrário: a laje tem que ALCANÇAR a seguinte, senão abre buraco no caminho. Ver a regra em bridge/src/dominio/regras.mjs.",
          "type": "number",
          "minimum": 1.5,
          "maximum": 14
        },
        "variacaoRaio": { "type": "number", "minimum": 0, "maximum": 0.5 },
        "espacamentoVertical": {
          "description": "Teto absoluto 8,4 = jumpHeight máximo (12) * 0,7. O teto real depende do jumpHeight deste mapa e é checado no validador. O PISO depende do formato e também é checado lá: no \"disco\" a subida é de pular e não desce de 3; na passarela (\"laje\") é de ANDAR e não passa da espessura do degrau. Ver ADR-009.1.",
          "type": "number",
          "minimum": 1,
          "maximum": 8.4
        },
        "variacaoHorizontal": {
          "description": "Passo horizontal entre uma plataforma e a seguinte, de CENTRO a centro. O que o pulo precisa vencer é o VÃO entre as bordas (passo menos os dois raios), e é esse vão que o validador compara com o alcance. No formato \"disco\" também tem que ser maior que o raio, senão um disco cobre o outro e a torre vira coluna. No formato \"laje\" tem que ser MENOR que a largura da laje, que é o que faz o caminho ser contínuo.",
          "type": "number",
          "minimum": 0,
          "maximum": 60
        },
        "materialAssetId": {
          "description": "A textura dos degraus. Um id só pinta a torre inteira igual; uma LISTA reveza as texturas degrau a degrau, na ordem dada, e é assim que se faz uma torre de blocos variados. Todos os ids têm que existir no acervo e estar aprovados (ADR-004).",
          "oneOf": [
            { "$ref": "#/$defs/idAcervo" },
            { "type": "array", "minItems": 1, "maxItems": 12, "uniqueItems": true, "items": { "$ref": "#/$defs/idAcervo" } }
          ]
        }
      }
    },
    "props": {
      "type": "array",
      "maxItems": 3,
      "items": {
        "type": "object",
        "additionalProperties": false,
        "required": ["tipo", "densidade", "aCadaNPlataformas"],
        "properties": {
          "tipo": { "$ref": "#/$defs/idAcervo" },
          "densidade": { "type": "number", "minimum": 0, "maximum": 1 },
          "aCadaNPlataformas": { "type": "integer", "minimum": 1, "maximum": 100 }
        }
      }
    },
    "marcos": {
      "description": "Um checkpoint visual a cada 250 plataformas e um marco topo na última. A cadência acompanhou a torre quando ela foi para 5000: a cada 50 seriam 99 marcos, e marco que aparece o tempo todo deixa de marcar alguma coisa. Ver P1.",
      "type": "array",
      "minItems": 1,
      "items": {
        "type": "object",
        "additionalProperties": false,
        "required": ["plataforma", "tipo"],
        "properties": {
          "plataforma": { "description": "Anda de 1 a totalPlataformas. O teto acompanha o de totalPlataformas: marco acima do topo da torre nao existe.", "type": "integer", "minimum": 1, "maximum": 5000 },
          "tipo": { "type": "string", "enum": ["checkpoint_visual", "topo"] }
        }
      },
      "contains": {
        "type": "object",
        "required": ["tipo"],
        "properties": { "tipo": { "const": "topo" } }
      },
      "minContains": 1,
      "maxContains": 1
    }
  },
  "$defs": {
    "idAcervo": {
      "description": "Id de item do acervo pré-aprovado (data/acervo.json). O Gemini ESCOLHE daqui, nunca inventa. Ver ADR-004.",
      "type": "string",
      "pattern": "^[a-z][a-z0-9_]*$",
      "maxLength": 64
    }
  }
}
