{
  "mapaId": "mundo-montado",
  "streamerId": "local",
  "nome": "Céu Apocaliptico com Gelo",
  "geradoPor": "manual",
  "totalPlataformas": 1000,
  "jumpHeight": 7,
  "skyboxAssetId": "skybox_apocaliptico",
  "paleta": {
    "primaria": "#bcd8ea",
    "secundaria": "#7fa8c4",
    "destaque": "#c9dced"
  },
  "plataformas": {
    "formato": "disco",
    "raioBase": 7.5,
    "variacaoRaio": 0.1,
    "espacamentoVertical": 4,
    "variacaoHorizontal": 16,
    "materialAssetId": [
      "textura_gelo",
      "textura_arcade",
      "textura_cyber",
      "textura_madeira",
      "textura_gelatina"
    ]
  },
  "props": [],
  "marcos": [
    {
      "plataforma": 50,
      "tipo": "checkpoint_visual"
    },
    {
      "plataforma": 100,
      "tipo": "checkpoint_visual"
    },
    {
      "plataforma": 150,
      "tipo": "checkpoint_visual"
    },
    {
      "plataforma": 200,
      "tipo": "checkpoint_visual"
    },
    {
      "plataforma": 250,
      "tipo": "checkpoint_visual"
    },
    {
      "plataforma": 300,
      "tipo": "checkpoint_visual"
    },
    {
      "plataforma": 350,
      "tipo": "checkpoint_visual"
    },
    {
      "plataforma": 400,
      "tipo": "checkpoint_visual"
    },
    {
      "plataforma": 450,
      "tipo": "checkpoint_visual"
    },
    {
      "plataforma": 500,
      "tipo": "checkpoint_visual"
    },
    {
      "plataforma": 550,
      "tipo": "checkpoint_visual"
    },
    {
      "plataforma": 600,
      "tipo": "checkpoint_visual"
    },
    {
      "plataforma": 650,
      "tipo": "checkpoint_visual"
    },
    {
      "plataforma": 700,
      "tipo": "checkpoint_visual"
    },
    {
      "plataforma": 750,
      "tipo": "checkpoint_visual"
    },
    {
      "plataforma": 800,
      "tipo": "checkpoint_visual"
    },
    {
      "plataforma": 850,
      "tipo": "checkpoint_visual"
    },
    {
      "plataforma": 900,
      "tipo": "checkpoint_visual"
    },
    {
      "plataforma": 950,
      "tipo": "checkpoint_visual"
    },
    {
      "plataforma": 1000,
      "tipo": "topo"
    }
  ]
}
