{
  "mapaId": "torre-vulcanica-01",
  "streamerId": "local",
  "nome": "Torre de Lava ao Pôr do Sol",
  "geradoPor": "gemini",
  "promptOriginal": "torre vulcânica ao entardecer, plataformas de rocha",
  "geradoEm": "2026-09-01T13:00:00Z",
  "totalPlataformas": 5000,
  "jumpHeight": 12,
  "skyboxAssetId": "skybox_por_do_sol",
  "paleta": {
    "primaria": "#C4462A",
    "secundaria": "#2B1B18",
    "destaque": "#F5A623"
  },
  "plataformas": {
    "formato": "disco",
    "raioBase": 7.5,
    "variacaoRaio": 0.1,
    "espacamentoVertical": 3.5,
    "variacaoHorizontal": 20,
    "materialAssetId": "textura_lava"
  },
  "props": [
    {
      "tipo": "fumaca",
      "densidade": 0.4,
      "aCadaNPlataformas": 10
    }
  ],
  "marcos": [
    {
      "plataforma": 250,
      "tipo": "checkpoint_visual"
    },
    {
      "plataforma": 500,
      "tipo": "checkpoint_visual"
    },
    {
      "plataforma": 750,
      "tipo": "checkpoint_visual"
    },
    {
      "plataforma": 1000,
      "tipo": "checkpoint_visual"
    },
    {
      "plataforma": 1250,
      "tipo": "checkpoint_visual"
    },
    {
      "plataforma": 1500,
      "tipo": "checkpoint_visual"
    },
    {
      "plataforma": 1750,
      "tipo": "checkpoint_visual"
    },
    {
      "plataforma": 2000,
      "tipo": "checkpoint_visual"
    },
    {
      "plataforma": 2250,
      "tipo": "checkpoint_visual"
    },
    {
      "plataforma": 2500,
      "tipo": "checkpoint_visual"
    },
    {
      "plataforma": 2750,
      "tipo": "checkpoint_visual"
    },
    {
      "plataforma": 3000,
      "tipo": "checkpoint_visual"
    },
    {
      "plataforma": 3250,
      "tipo": "checkpoint_visual"
    },
    {
      "plataforma": 3500,
      "tipo": "checkpoint_visual"
    },
    {
      "plataforma": 3750,
      "tipo": "checkpoint_visual"
    },
    {
      "plataforma": 4000,
      "tipo": "checkpoint_visual"
    },
    {
      "plataforma": 4250,
      "tipo": "checkpoint_visual"
    },
    {
      "plataforma": 4500,
      "tipo": "checkpoint_visual"
    },
    {
      "plataforma": 4750,
      "tipo": "checkpoint_visual"
    },
    {
      "plataforma": 5000,
      "tipo": "topo"
    }
  ]
}
